#CODE;ENGLISH;FRENCH;GERMAN;;SPANISH;;;;;;;;;x
hold_a_prision_fight;Hold a prison fight;Tenir un combat en prison;Halten Sie einen Gefängniskampf;;Realizar una pelea en la prisión;;;;;;;;;x
hold_a_prision_fight_desc;Prisoners who are in the dungeons will be forced to fight each other;Les prisonniers qui sont dans les donjons seront forcés de se battre les uns les autres.;Gefangene, die in den Kerkern sind, werden gezwungen sein, sich gegenseitig zu bekämpfen;;Los prisioneros que se encuentren en las mazmorras serán obligados a luchar entre sí;;;;;;;;;x
EVTDESCPFSK.2;;Les prisonniers logés dans mes cachots sont confortables et très chauds, à mon avis. Ce sont de sales traîtres qui ont endommagé ma confiance. Je devrais faire quelque chose pour les rendre bien mérités\n. Je vais les faire se battre entre eux et les voir se vautrer dans la boue de la prison!;;;Los prisioneros alojados en mis mazmorras están cómodos y bien calientes, a mi parecer. Son sucios traidores que mellaron mi confianza. Debería hacer algo para que tengan su merecido.\n¡Haré que peleen entre sí y disfrutaré el espectáculo de verlos revolcarse en el fango de la cárcel!;;;;;;;;;x
EVTDESCPFSK.3;ENGLISH;Vous avez apprécié ma généreuse hospitalité trop longtemps. Dans quelques jours, vous serez obligé de me payer d'une manière ou d'une autre pour ma généreuse hospitalité.\nPréparez-vous!\nMangez et buvez autant que vous le pouvez. Bientôt nous verrons les visages les uns des autres.;GERMAN;;Has disfrutado demasiado tiempo de mi generosa hospitalidad. En algunos días, te verás obligado a pagarme de alguna forma mi generosa hospitalidad.\n¡Prepárate!\nCome y bebe todo lo que puedas. Pronto nos veremos las caras.;;;;;;;;;x
EVTOPTAPFSK.3;ENGLISH;J'enseignerai à mon mauvais geôlier tout mon courage.;GERMAN;;Le enseñaré a mi ruin carcelero toda mi valentía;;;;;;;;;x
EVTDESCPFSK.4;ENGLISH;La lutte a commencé! Les prisonniers impurs se rassemblent aux portes de leurs cellules. Mes gardes leur donnent des fusils chargés, parfaits pour prolonger le spectacle. Ils se regardent avec étonnement, tandis que la foule se précipite les uns contre les autres. Les brochettes des spectateurs et les menaces des gardes prennent effet: les malheureux s'engagent dans une lutte totale.;Der Kampf hat begonnen! Die unreinen Gefangenen versammeln sich an den Türen ihrer Zellen. Meine Wachen geben ihnen geladene Waffen, die perfekt sind, um die Show zu verlängern. Sie sehen sich verwundert an, während der Mob sie gegeneinander stößt. Die Spieße der Zuschauer und die Drohungen der Wächter treten in Kraft: Die Unglücklichen führen einen totalen Kampf aus.;;¡La pelea ha comenzado! Los inmundos prisioneros se congregan en las puertas de sus celdas. Mis guardias les entregan armas embbotadas, que son perfectas para prolongar el espectáculo. Se miran atónitos entre sí, mientras la chusma los azuza unos contra otros. Los pinchos de los espectadores y las amenazas de los guardias surgen efecto: los desdichados se enzarzan en una lucha sin cuartel.;;;;;;;;;x
EVTOPTAPFSK.4;Fight against each other, you, animals!;Luttez les uns contre les autres, vous, les animaux!;Kämpfe gegeneinander, du, Tiere!;;¡Luchen entre sí, animales!;;;;;;;;;x
